product,description,page
ARDEX N 23,"Opis: Klej do kamienia naturalnego i płytek ceramicznych, szary MicroTec. Wykorzystuje efekt ARDURAPID®. Układanie płyt z kamienia naturalnego, z kamienia ciosanego, płytek betonowych, płytek cotto na warstwie cienko- i średniowarstwowej bez przebarwień i wykwitów. Osadzanie i układanie płytek z kamionki i kamionki szlachetnej. Osadzanie i układanie jasnych półprzeźroczystych płyt z marmuru i innych kamieni naturalnych o charakterze półprzeźroczystym. Po ok. 2 godzinach możliwe obciążanie ruchem pieszym oraz fugowanie. Grubość warstwy kleju 2–15 mm. Bardzo dobra przyczepność. Łatwy w aplikacji. Szybkie schnięcie. Dzięki technologii AMF uzyskujemy dodatkową pewność wykorzystującą wzmocnienie włóknami: - naprężenia zostają skompensowane, - wzmocniona wytrzymałość klejenia, - odkształcenia zostają zredukowane. Układanie bez przebarwień i wykwitów: – płyt z kamienia naturalnego, np. z marmuru, marmuru jurajskiego, płyt Solnhofer itp. – płyt z naturalnego kamienia ciosanego, np. z granitu, kwarcytu itp. – płyt betonowych, z aglomarmuru i płyt cotto Osadzanie i układanie płytek z kamionki i kamionki szlachetnej. Do stosowania: wewnątrz, ściany i podłogi. Proporcje mieszania: ok. 8,25-8,75 l wody : 25 kg proszku (co odpowiada ok. 1 części objętościowej wody : 2 1/2 części obj. proszku). Czas otwarty (EN 1346): ok. 30 min. (pomiar na świeżej zaprawie). Czas korekty (+ 20°C): ok. 15 min. Palność (DIN 4102): klasa E. Możliwość stosowania z systemami ogrzewania podłogowego: tak. GISCODE: ZP1 - z cementem niskochromianowym. Gęstość nasypowa: ok. 1,2 kg/l. Gęstość świeżej zaprawy: ok. 1,4 kg/l. Zużycie materiału: przy gładkim podłożu: paca zębata 3x3x3 mm: ok. 1,2 kg/m2 proszku; paca zębata 6x6x6 mm: ok. 1,9 kg/m2 proszku; paca zębata 8x8x8 mm: ok. 2,4 kg/m2 proszku; paca zębata 10x10x10 mm: ok. 2,9 kg/m2 proszku; paca zębata 12x12x12 mm: ok. 3,4 kg/m2 proszku. Czas przydatności po rozrobieniu (+20°C): ok. 45-60 min. Możliwość obciążenia ruchem pieszym (+20°C): po ok. 2 godzinach możliwe jest fugowanie Magazynowanie: w suchych pomieszczeniach ok. 12 miesięcy w oryginalnie zamkniętym opakowaniu. Opakowanie Nr artykułu EAN-Nr Paleta 25 kg worek 16770 40 24705 16771 0 40 worków 5 kg wiaderko 1316771550 40 24705 16771 0 -",74
ARDEX N 23 W,"Opis: Klej do kamienia naturalnego i płytek ceramicznych, biały MicroTec. Efekt ARDURAPID® Układanie płyt z kamienia naturalnego, z kamienia ciosanego, płytek betonowych, płytek cotto na warstwie cienko- i średniowarstwowej bez przebarwień i wykwitów. Osadzanie i układanie płytek z kamionki i kamionki szlachetnej. Osadzanie i układanie jasnych półprzeźroczystych płyt z marmuru i innych kamieni naturalnych o charakterze półprzeźroczystym. Po ok. 2 godzinach możliwe obciążanie ruchem pieszym oraz fugowanie. Grubość warstwy kleju 2–15 mm. Bardzo dobra przyczepność. Łatwy w aplikacji. Szybkie schnięcie. Osadzanie i układanie płytek z kamionki i kamionki szlachetnej. Dzięki technologii AMF uzyskujemy dodatkową pewność wykorzystującą wzmocnienie włóknami: - naprężenia zostają skompensowane, - wzmocniona wytrzymałość klejenia, - odkształcenia zostają zredukowane. Układanie bez przebarwień i wykwitów: - płyt z kamienia naturalnego, np. z marmuru, marmuru jurajskiego, płyt Solnhofer itp. - płyt z naturalnego kamienia ciosanego, np. z granitu, kwarcytu itp. - płyt betonowych, z aglomarmuru i płyt cotto. Do stosowania: wewnątrz, ściany i podłogi. Proporcje mieszania: ok. 8,25-8,75 l wody : 25 kg proszku (co odpowiada ok. 1 części objętościowej wody : 2 1/2 części obj. proszku). Czas otwarty (EN 1346): ok. 30 min. (pomiar na świeżej zaprawie). Czas korekty (+ 20°C): ok. 15 min. Palność (DIN 4102): klasa E. Możliwość stosowania z systemami ogrzewania podłogowego: tak/ GISCODE: ZP1 - zawiera cement niskochromianowy. Gęstość nasypowa: ok. 1,2 kg/l Gęstość świeżej zaprawy: ok. ok. 1,4 kg/l Zużycie materiału: przy gładkim podłożu: paca zębata 3x3x3mm: ok. 1,2 kg proszku na m2; paca zębata 6x6x6mm: ok. 1,9 kg proszku na m2; paca zębata 8x8x8mm: ok. 2,4 kg proszku na m2;; paca zębata 10x10x10mm: ok. 2,9 kg proszku na m2 paca zębata 12x12x12mm: ok. 3,4 kg proszku na m2. Czas przydatności po rozrobieniu (+20°C): ok. 45–60 min Możliwość obciążenia ruchem pieszym (+20°C): po ok. 2 godzinach, potem możliwe jest fugowanie. Magazynowanie: w suchych pomieszczeniach ok. 12 miesięcy w oryginalnie zamkniętym opakowaniu. Opakowanie Nr artykułu EAN-Nr Paleta Worek 25 kg 16770 40 24705 16771 0 Paleta na 40 worków Wiaderko 5kg 1316771550 40 24705 16771 7 72 wiaderka na palecie",75
ARDEX X 30,"Opis: Zaprawa grubowarstwowa do kamienia naturalnego. Do układania niewrażliwych na wilgoć, stabilnych kamieni naturalnych i prefabrykatów betonowych na warstwie cienkiej, średniej i grubowarstwowej. Grubości warstwy kleju 5-30 mm. Po 3 godzinach możliwość obciążenia ruchem pieszym. Łatwa do aplikacji. Układanie niewrażliwych na wilgoć, stabilnych kamieni sztucznych i naturalnych oraz naturalnych płyt kamiennych takich jak kwarcyt i porfir. Produkt zgodny z normą eN 12004 C2 / e. Do stosowania: wewnątrz i zewnątrz, podłogi. Proporcje mieszania: ok. 8, 25 l wody : 25 kg proszku. Ciężar świeżej zaprawy: ok. 1,6 kg/l. Czas otwarty ( EN 1346 ): ok. 30 minut (pomiar na świeżej zaprawie). Czas korekty ( 20 ° C ): 15 minut. Możliwość stosowanie z systemami ogrzewania podłogowego: tak. GISCODE : ZP 1 - produkt zawiera cement o niskiej zawartości chromianów. Zużycie materiału: ok. 1,1 kg proszku na m2 na 1 mm grubości warstwy. paca zębata 10x10x10mm: ok. 3,8 kg/m2. Czas pracy (+20°C): 70 minut. Możliwość obciążania ruchem pieszym (+20°C): po ok. 3-4 godzinach, fugowanie po ok. 24 godzinach. Magazynowanie: w suchych pomieszczeniach ok. 12 miesięcy w oryginalnie zamkniętym opakowaniu. Opakowanie Nr artykułu EAN-Nr Paleta 25kg worek 16774 40 24705 16774 1 40 worków/paleta",76
ARDEX X 32,"Opis: Elastyczna zaprawa grubowarstwowa do kamienia naturalnego. Na bazie cementu, wykorzystuje efekt ARDURAPID®. Osadzanie bez tendencji do przebarwień. Do bezwykwitowego osadzania kamienia naturalnego, płytek ceramicznych oraz materiałów izolacyjnych. Osadzanie płytek ceramicznych z gresu, kamionki i kamionki szlachetnej. Po 3 godzinach możliwe obciążanie ruchem pieszym oraz fugowanie. Grubość zaprawy 3-30 mm. Szybkoschnący. Wysoka wydajność, łatwy w nakładaniu. Wyrównywanie powierzchni ścian i podłóg przed przystąpieniem do prac związanych z dalszym układaniem warstw wierzchnich. Platerowanie na jastrychach z ogrzewaniem podłogowym. Wolne od przebarwień i wykwitów układanie: - płyt i płytek z kamienia naturalnego z: marmuru, marmuru jurajskiego, granitu, kwarcytu, - płyt betonowych i aglomarmurowych, - płytek gresowych z kamionki i fajansu, kamionki szlachetnej. Do stosowania: wewnątrz i zewnątrz, ściany i podłogi. Normy: zaprawy cienkowarstwowe EN 12004 C2/FTE S1. Proporcje mieszania: na podłodze: ok. 8-8,5 l wody : 25 kg proszku; na ścianie: ok. 7,5 l wody : 25 kg proszku. Ciężar właściwy: ok. 1,1 kg/l Gęstość świeżej zaprawy: ok. 1,6 kg/l Zużycie materiału: w przypadku gładkiego podłoża: ok. 1,2 kg/m2/mm; packa 8x8x8 mm: ok. 3,3 kg/m2. Czas pracy (20°C): ok. 60 min. Czas układania płytek: ok. 20 min (po nałożeniu zaprawy). Czas korekcji: ok. 20-30 min. Możliwość obciążania ruchem pieszym/fugowania (20°C): po ok. 3 godz. od nałożenia. Przydatność w systemie ogrzewania podłogowego: tak. GISCODE: ZP 1 - produkt zawiera cement niskochromianowy. Magazynowanie: ok. 12 miesięcy w oryginalnie zamkniętym opakowaniu, w suchym pomieszczeniu. Opakowanie Nr artykułu EAN-Nr Paleta 25 kg worek 54201 40 24705 54201 2 40 worków",77
ARDEX WA (klej),"Opis: Klej epoksydowy. Do osadzania oraz klejenia płytek ceramicznych, płyt, klinkieru, płyt wiórowych oraz mozaiki. Klej na bazie żywicy epoksydowej spełniający wymogi normy EN 12004 R 2 T. Odporny na działanie środków chemicznych, wysoce odporny na obciążenia. Osadzanie i klejenie płytek ceramicznych, płyt, klinkieru, płyt wiórowych oraz mozaiki na budowlach specjalnych, w których zaprawy wiązane cementem nie są wystarczająco odporne na obciążenia lub są zbyt mało trwałe, np. w: – rzeźniach, mleczarniach, kuchniach użyteczności publicznej, browarach, akumulatorowniach, kąpieliskach i basenach, basenach termalnych i innych obszarach szczególnie narażonych na chemiczne oraz mechaniczne obciążenia. Do stosowania: wewnątrz i zewnątrz, ściany i podłogi. Normy: EN 12004 R2/T. Gęstość świeżej zaprawy: ok. 1,5 kg/l. Zużycie materiału: do klejenia na gładkim podłożu: packa 3x3x3 mm: ok. 1,5 kg/m2; packa 6x6x6 mm: ok. 2,7 kg/m2; packa 8x8x8 mm: ok. 3,7 kg/m2. Czas pracy (20°C): ok. 80 min. Czas układania płytek: ok. 80 min. Czas korekcji: ok. 80 min. Możliwość obciążania ruchem pieszym (20°C): po wystarczającym utwardzeniu po ok. 12 godz. GISCODE: RE 1 - bez substancji rozpuszczających. Opakowanie: puszki po 3 kg pasty „WA”; puszki po 1 kg utwardzacza „WA”. Magazynowanie: w suchych pomieszczeniach ok. 12 miesięcy w oryginalnie zamkniętym opakowaniu. Pojemniki składować w pozycji pionowej, nie przewracać. Opakowanie Nr artykułu EAN-Nr Paleta 4 kg puszka 60401 40 24705 60401 7 96 puszek",78
ARDEX G4 BASIC 1-6,"Opis: Cementowa masa fugowa. Na bazie cementu. Do spoin o szerokości od 1 do 6 mm. Długi czas mycia. Tworzy zwartą i gładką powierzchnię fugi. dobra przyczepność do krawędzi okładzin. duża wytrzymałość. Nadaje się do ogrzewania podłogowego. Do fugowania płytek ceramicznych, płytek szklanych, nie wrażliwych na działanie wilgoci płyt z kamienia naturalnego i płyt betonowych, mozaiki szklanej, porcelanowej i ceramicznej. Do stosowania: wewnątrz i zewnątrz. Proporcje mieszania: ok. 3,5 litra wody : 12,5 kg proszku. Stosunek mieszania: ok. 1 część wody : 2,7 części proszku. Gęstość nasypowa: ok. 1,3 kg/l. Gęstość świeżej zaprawy: ok. 2,1 kg/l. Zużycie materiału: szerokość spoiny 3 mm, głębokość spoiny 5 mm dla płytek ceramicznych i mozaiki: 60 x 60 cm ok. 0,10 kg /m2; 30 x 60 cm ok. 0,15 kg/m2; 30 x 30 cm ok. 0,20 kg /m2; 15 x 15 cm 0,35 kg /m2; 10 x 10 cm ok. 0,50 kg /m2; 5 x 5 cm ok. 1,00 kg /m2. Dodatkowe straty związane z nanoszeniem zbyt dużej ilości materiału, wynoszą w zależności od powierzchni płytek i sposobu aplikacji od 0,05 do 0,10 kg/m2. Twardość mierzona kulką: po 1 dniu ok. 40 N/mm2; po 3 dniach ok. 60 N/mm2; po 7 dniach ok. 80 N/mm2; po 28 dniach ok. 90 N/mm2. Przydatność w systemie ogrzewania podłogowego: tak. Czas pracy (+20°C ): 1,5 godziny. Możliwość obciążania ruchem pieszym (+20°C ): po ok. 4 godzinach. Magazynowanie: w suchych pomieszczeniach ok. 12 miesięcy w oryginalnie zamkniętym opakowaniu. Opakowanie Nr artykułu Kolor EAN-Nr Paleta 12,5 kg worek 19565 brylantowobiały 40 24705 19565 2 80 worków 5 kg worek 19558 brylantowobiały 40 24705 19558 4 208 worków 12,5 kg worek 19566 pergamon 40 24705 19566 9 80 worków 12,5 kg worek 19567 srebrnoszary 40 24705 19567 6 80 worków 5 kg worek 19560 srebrnoszary 40 24705 19560 7 208 worków 5 kg worek 19561 jasnoszary 40 24705 19561 208 worków 12,5 kg worek 19568 cementowoszary 40 24705 19568 3 80 worków 5 kg worek 19562 cementowoszary 40 24705 19562 1 208 worków 12,5 kg worek 19569 jaśmin 40 24705 19569 0 80 worków 12,5 kg worek 19570 bahama beż 40 24705 19570 6 80 worków",79
ARDEX G5 BASIC 2-15,"Opis: Cementowa masa fugowa. Do spoin o szerokości od 2 do 15 mm. Długi czas mycia. Tworzy zwartą i gładką powierzchnię fugi. dobra przyczepność do krawędzi okładzin. Duża wytrzymałość. Nadaje się do ogrzewania podłogowego. Do fugowania płytek ceramicznych, płytek szklanych, nie wrażliwych na działanie wilgoci płyt z kamienia naturalnego i płyt betonowych, mozaiki szklanej, porcelanowej i ceramicznej, klinkieru cegły oraz pustaków szklanych. Do stosowania: wewnątrz i zewnątrz, ściany i podłogi. Proporcje mieszania: ok. 5 litrów wody : 25 kg proszku. Stosunek mieszania: ok. 1 część wody : 3,4 części proszku. Gęstość nasypowa: ok. 1,5 kg/l. Gęstość świeżej zaprawy: ok. 2,2 kg/l. Zużycie materiału: szerokość spoiny 10 mm, głębokość spoiny 5 mm dla płytek ceramicznych i mozaiki: 60 x 60 cm ok. 0,2 kg/m2; 30 x 60 cm ok. 0,3 kg/m2; 30 x 30 cm ok. 0,5 kg/m2; 15 x 15 cm 1,00 kg/m2; 10 x 10 cm ok. 1,5 kg/m2. Dodatkowe straty związane z nanoszeniem zbyt dużej ilości materiału, wynoszą w zależności od powierzchni płytek i sposobu aplikacji od 0,05 do 0,10 kg/m2. Twardość mierzona kulką: po 1 dni ok. 60 N/mm2; po 3 dni ok. 80 N/mm2; po 7 dni ok. 100 N/mm2; po 28 dniach ok. 120 N/mm2. Przydatność w systemie ogrzewania podłogowego: tak. Czas pracy (+20°C): 1,5 godziny. Możliwość obciążania ruchem pieszym (+20°C): po ok. 5 godzinach. Magazynowanie: w suchych pomieszczeniach ok. 12 miesięcy w oryginalnie zamkniętym opakowaniu. Opakowanie Nr artykułu Kolor EAN-Nr Paleta 25 kg worek 19519 srebrnoszary 40 24705 19519 5 40 worków 25 kg worek 19520 szary 40 24705 19520 1 40 worków 25 kg worek 19518 cementowoszary 40 24705 19518 8 40 worków 25 kg worek 19517 bazalt 40 24705 19517 1 40 worków",80
ARDEX G6 FLEX 1-6,"Opis: Elastyczna masa fugowa. Na bazie cementu. Do spoin o szerokości od 1 do 6 mm. Elastyczna, odporna na działanie brudu i wody. Tworzy zwartą i gładką powierzchnię fugi. dobra przyczepność do krawędzi okładzin oraz duża wytrzymałość. Bez wypełniaczy kwarcowych. Z ochroną zapobiegającą powstawaniu pleśni, nadaje się do ogrzewania podłogowego i ściennego. Do fugowania płytek ceramicznych, płytek szklanych, nie wrażliwych na działanie wilgoci płyt z kamienia naturalnego i płyt betonowych, mozaiki szklanej, porcelanowej i ceramicznej. Do stosowania: wewnątrz i zewnątrz. Proporcje mieszania: ok. 3,5 litra wody : 12,5 kg proszku. Stosunek mieszania: ok. 1 część wody : 3 części proszku. Gęstość nasypowa: ok. 1,2 kg/l. Gęstość świeżej zaprawy: ok. 1,8 kg/l. Zużycie materiału: szerokość spoiny 3 mm, głębokość spoiny 5 mm dla płytek ceramicznych i mozaiki: 60 x 60 cm ok. 0,10 kg /m2; 30 x 60 cm ok. 0,15 kg/m2; 30 x 30 cm ok. 0,20 kg /m2; 15 x 15 cm 0,35 kg /m2; 10 x 10 cm ok. 0,45 kg /m2; 5 x 5 cm ok. 0,90 kg /m2. Dodatkowe straty związane z nanoszeniem zbyt dużej ilości materiału, wynoszą w zależności od powierzchni płytek i sposobu aplikacji od 0,05 do 0,10 kg /m2. Twardość mierzona kulką: po 1 dniu ok. 35 N/mm2; po 3 dniach ok. 55 N/mm2; po 7 dniach ok. 65 N/mm2; po 28 dniach ok. 75 N/mm2. Przydatność w systemie ogrzewania podłogowego: tak. Czas pracy (+20°C): 1,5 godziny. Możliwość obciążania ruchem pieszym (+20°C): po ok. 4 godzinach. Magazynowanie: w suchych pomieszczeniach ok. 12 miesięcy w oryginalnie zamkniętym opakowaniu. Opakowanie Nr artykułu Kolor EAN-Nr Paleta 12,5 kg worek 19581 brylantowobiały 40 24705 19581 2 80 worków 5 kg worek 19571 brylantowobiały 40 24705 19571 3 208 worków 5 kg worek 19572 pergamon 40 24705 19572 0 208 worków 12,5 kg worek 19578 srebrnoszary 40 24705 19578 2 80 worków 5 kg worek 19573 srebrnoszary 40 24705 19573 7 208 worków 12,5 kg worek 19580 jasnoszary 40 24705 19580 5 80 worków 5 kg worek 19574 jasnoszary 40 24705 19574 4 208 worków 12,5 kg worek 19579 cementowoszary 40 24705 19579 9 80 worków 5 kg worek 19575 cementowoszary 40 24705 19575 1 208 worków 5 kg worek 19576 jaśmin 40 24705 19576 8 208 worków 5 kg worek 19577 bahama beż 40 24705 19577 5 208 worków",81
ARDEX G7 FLEX 2-15,"Opis: Elastyczna masa fugowa. Na bazie cementu. Do spoin o szerokości od 2 do 15 mm. Specjalnie dla ceramiki i kamionki. elastyczna, odporna na działanie brudu i wody. długi czas pracy. Dobra przyczepność do krawędzi okładzin. duża wytrzymałość. Idealna do dużych powierzchni. Z ochroną zapobiegającą powstawaniu pleśni. Nadaje się do ogrzewania podłogowego i ściennego. Do fugowania płytek ceramicznych, płytek szklanych, nie wrażliwych na działanie wilgoci płyt z kamienia naturalnego i płyt betonowych, mozaiki szklanej, porcelanowej i ceramicznej. Do stosowania: wewnątrz i zewnątrz. Proporcje mieszania: ok. 2,4 litra wody : 12,5 kg proszku. Stosunek mieszania: ok. 1 część wody : 4 części proszku. Gęstość nasypowa: ok. 1,4 kg/l. Gęstość świeżej zaprawy: ok. 2,1 kg/l. Zużycie materiału: szerokość spoiny 10 mm, głębokość spoiny 5 mm dla płytek ceramicznych: 60 x 60 cm ok. 0,3 kg/m2; 30 x 60 cm ok. 0,4 kg/m2; 30 x 30 cm ok. 0,5 kg/m2; 15 x 15 cm 1,0 kg/m2; 10 x 10 cm 1,5 kg/m2. Dodatkowe straty związane z nanoszeniem zbyt dużej ilości materiału, wynoszą w zależności od powierzchni płytek i sposobu aplikacji od 0,05 do 0,10 kg/m2. Twardość mierzona kulką: po 1 dni ok. 40 N/mm2; po 3 dni ok. 50 N/mm2; po 7 dni ok. 60 N/mm2; po 28 dniach ok. 70 N/mm2. Przydatność w systemie ogrzewania podłogowego: tak. Czas pracy (+20°C): 45 minut. Możliwość obciążania ruchem pieszym (+20°C): po upływie ok. 90 minut. Magazynowanie: w suchych pomieszczeniach ok. 12 miesięcy w oryginalnie zamkniętym opakowaniu. Opakowanie Nr artykułu Kolor EAN-Nr Paleta 12,5 kg worek 19536 srebrnoszary 40 24705 19536 2 80 worków 5 kg worek 19532 srebrnoszary 40 24705 19532 4 208 worków 12,5 kg worek 19537 szary 40 24705 19537 9 80 worków 5 kg worek 19533 szary 40 24705 19533 1 208 worków 12,5 kg worek 19539 cementowoszary 40 24705 19539 3 80 worków 5 kg worek 19534 cementowoszary 40 24705 19534 8 208 worków 12,5 kg worek 19540 bazalt 40 24705 19540 9 80 worków 5 kg worek 19535 bazalt 40 24705 19535 5 208 worków",82
ARDEX G8S FLEX 1-6,"Opis: Elastyczna masa fugowa, szybka. Na bazie cementu. Do spoin o szerokości od 1 do 6 mm. Szybkowiążąca i elastyczna. Odporna na działanie brudu i wody. Tworzy zwartą i gładką powierzchnię fugi. dobra przyczepność do krawędzi okładzin. duża wytrzymałość. Bez wypełniaczy kwarcowych. Z ochroną zapobiegającą powstawaniu pleśni. Nadaje się do ogrzewania podłogowego i ściennego. Do fugowania płytek ceramicznych, płytek szklanych, nie wrażliwych na działanie wilgoci płyt z kamienia naturalnego i płyt betonowych, mozaiki szklanej, porcelanowej i ceramicznej. Do stosowania: wewnątrz i zewnątrz. Proporcje mieszania: ok. 2,75 litra wody : 12,5 kg proszku. Stosunek mieszania: ok. 1 część wody : 3,4 części proszku. Gęstość nasypowa: ok. 1,3 kg/l. Gęstość świeżej zaprawy: ok. 2,0 kg/l. Zużycie materiału: szerokość spoiny 3 mm, głębokość spoiny 5 mm dla płytek ceramicznych i mozaiki: 60 x 60 cm ok. 0,10 kg/m2; 30 x 60 cm ok. 0,15 kg/m2; 30 x 30 cm ok. 0,20 kg/m2; 15 x 15 cm 0,35 kg/m2; 10 x 10 cm ok. 0,50 kg/m2; 5 x 5 cm ok. 1,00 kg/m2. Dodatkowe straty związane z nanoszeniem zbyt dużej ilości materiału, wynoszą w zależności od powierzchni płytek i sposobu aplikacji od 0,05 do 0,10 kg / m2. Twardość mierzona kulką: po 1 dniu ok. 40 N/mm2; po 3 dniach ok. 55 N/mm2; po 7 dniach ok. 75 N/mm2; po 28 dniach ok. 80 N/mm2. Przydatność w systemie ogrzewania podłogowego: tak. Czas pracy (+20°C): ok. 30 min. Możliwość obciążania ruchem pieszym (+20° C): po ok. 90 minutach. Magazynowanie: w suchych pomieszczeniach ok. 12 miesięcy w oryginalnie zamkniętym opakowaniu. Opakowanie Nr artykułu Kolor EAN-Nr Paleta 5 kg worek 19594 biały 40 24705 19594 2 208 worków 5 kg worek 19591 pergamon 40 24705 19591 1 208 worków 12,5 kg worek 19600 srebrnoszary 40 24705 19600 0 80 worków 5 kg worek 19593 srebrnoszary 40 24705 19593 5 208 worków 5 kg worek 19588 jasnoszary 40 24705 19588 1 208 worków 5 kg worek 24116 szary 40 24705 24116 8 208 worków 12,5 kg worek 19599 kamiennoszary 40 24705 19599 7 80 worków 5 kg worek 19587 cementowoszary 40 24705 19587 4 208 worków 5 kg worek 24180 kamiennoszary 40 24705 24180 9 208 worków 12,5 kg worek 19601 cementowoszary 40 24705 19601 7 80 worków 5 kg worek 19595 cementowoszary 40 24705 19595 9 208 worków 12,5 kg worek 19598 bazalt 40 24705 19598 0 80 worków 5 kg worek 19585 bazalt 40 24705 19585 0 208 worków 12,5 kg worek 19597 antracyt 40 24705 19597 3 80 worków 5 kg worek 19582 antracyt 40 24705 19582 9 208 worków 5 kg worek 19589 jaśmin 40 24705 19589 8 208 worków 5 kg worek 19592 piaskowy beż 40 24705 19592 8 208 worków 5 kg worek 19583 bahama beż 40 24705 19583 6 208 worków 5 kg worek 19590 jurajski beż 40 24705 19590 4 208 worków 5 kg worek 24115 szarobrązowy 40 2470 24115 1 208 worków 5 kg worek 19584 bali brąz 40 24705 19584 3 208 worków 5 kg worek 19586 ciemnobrązowy 40 24705 19586 7 208 worków",83
ARDEX G9S FLEX 2-15,"Opis: Elastyczna masa fugowa, szybka. Na bazie cementu. Do spoin o szerokości od 2 do 15 mm. Specjalnie do gresu, na balkony i tarasy. Szybkowiążąca, elastyczna. Odporna na działanie brudu i wody. dobra przyczepność do krawędzi okładzin. duża wytrzymałość. Z ochroną zapobiegającą powstawaniu pleśni. Nadaje się do ogrzewania podłogowego i ściennego. Do fugowania płytek ceramicznych, płytek szklanych, nie wrażliwych na działanie wilgoci płyt z kamienia naturalnego i płyt betonowych, mozaiki szklanej, porcelanowej, ceramicznej oraz klinkieru, płyt wiórowych i płyt szklanych. Do stosowania: wewnątrz i zewnątrz. Proporcje mieszania: ok. 2,4 litra wody : 12,5 kg proszku. Stosunek mieszania: ok. 1 część wody : 4 części proszku. Gęstość nasypowa: ok. 1,3 kg/l. Gęstość świeżej zaprawy: ok. 2,1 kg/l. Zużycie materiału: szerokość spoiny 6 mm, głębokość spoiny 5 mm dla płytek ceramicznych: 60 x 60 cm ok. 0,20 kg/m2; 30 x 60 cm ok.. 0,30 kg/m2; 30 x 30 cm ok. 0,40 kg/m2; 15 x 15 cm 0,60 kg/m2; 10 x 10 cm 0,90 kg/m2; 5 x 5 cm 1,80 kg/m2. Dodatkowe straty związane z nanoszeniem zbyt dużej ilości materiału, wynoszą w zależności od powierzchni płytek i sposobu aplikacji od 0,05 do 0,10 kg/m2. Twardość mierzona kulką: po 1 dni ok. 35 N/mm2; po 3 dni ok. 40 N/mm2; po 7 dni ok. 50 N/mm2; po 28 dniach ok. 60 N/mm2. Przydatność w systemie ogrzewania podłogowego: tak. Czas pracy (+20°C): 30 minut. Możliwość obciążania ruchem pieszym (+20°C): po upływie ok. 90 minut. Magazynowanie: w suchych pomieszczeniach ok. 12 miesięcy w oryginalnie zamknięty opakowaniu. Opakowanie Nr artykułu Kolor EAN-Nr Paleta 12,5 kg worek 55087 srebrnoszary 40 24705 19557 7 80 worków 5 kg worek 55088 srebrnoszary 40 24705 19541 6 208 worków 12,5 kg worek 55087 szary 40 24705 19547 8 80 worków 5 kg worek 55088 szary 40 24705 19542 3 208 worków 12,5 kg worek 55087 cementowoszary 40 24705 19553 9 80 worków 5 kg worek 55088 cementowoszary 40 24705 19543 0 208 worków 12,5 kg worek 55087 bazalt 40 24705 19555 3 80 worków 5 kg worek 55088 bazalt 40 24705 19544 7 208 worków 12,5 kg worek 55087 antracyt 40 24705 19556 0 80 worków 5 kg worek 55088 antracyt 40 24705 19545 4 208 worków 5 kg worek 55088 piaskowy 40 24705 19546 1 208 worków",84
ARDEX G 10 PREMIUM,"Opis: Elastyczna zaprawa fugowa, PREMIUM. Do szerokości fug od 1 do 10 mm. Wysoka trwałość koloru. Bardzo gładka powierzchni spoiny. Elastyczna. Wysoka odporność na wnikanie wody i zabrudzenia. Wysoka przyczepność do krawędzi okładzin. Wysoka wytrzymałość. Na ogrzewanie podłogowe i ścienne. Na bazie cementu. W zależności od techniki fugowania i powierzchni płytek należy uwzględnić dodatkowe zużycie na poziomie 0,05-0,10 kg/m2. Do fugowania: – wszelkich okładzin ceramicznych, – okładzin szklanych, – do kamienia naturalnego i płyt betonowych (odpornych na wilgoć), – mozaik szklanej, porcelanowej, ceramicznej, – szczególnie do okładzin gresowych. Do stosowania: wewnątrz i zewnątrz, ściany i podłogi. Proporcje mieszania: ok. 1,7 l wody : 5 kg proszku. Ciężar właściwy: ok. 1 kg/l. Ciężar świeżej zaprawy: ok. 1,7 kg/l. Zużycie materiału: przy szerokość spoiny 3 mm i głębokości 5 mm dla płytek: 60×60 cm ok. 0,10 kg/m2; 60×30 cm ok. 0,15 kg/m2; 30×30 cm ok. 0,20 kg/m2; 15×15 cm ok. 0,35 kg/m2;10×10 cm ok. 0,45 kg/m2; 5×5 cm ok. 0,90 kg/m2. Czas pracy (20°C): ok. 30 min. Możliwość obciążania ruchem pieszym (20°C): po ok. 90 min. Przydatność w systemie ogrzewania podłogowego: tak. GISCODE: ZP 1 - zawiera cement niskochromianowy. EMICODE: EC1PLUSR - bardzo niski poziom emisji. Magazynowanie: w suchych pomieszczeniach, przez 12 miesięcy w oryginalnie zamkniętym opakowaniu. Opakowanie Nr artykułu Kolor EAN-Nr Paleta 5kg wiadro 32512 biały 40 24705 32512 7 78 wiader 5kg wiadro 32513 pergamon 40 24705 32512 7 78 wiader 5kg wiadro 32514 srebrnoszary 40 24705 32513 4 78 wiader 5kg wiadro 32517 jasnoszary 40 24705 32514 1 78 wiader 5kg wiadro 32518 piaskowoszary 40 24705 32518 9 78 wiader 5kg wiadro 32520 szary 40 24705 32520 2 78 wiader 5kg wiadro 32521 kamiennoszary 40 24705 32521 9 78 wiader 5kg wiadro 32519 cementowoszary 40 24705 32519 6 78 wiader 5kg wiadro 32522 bazalt 40 24705 32522 6 78 wiader 5kg wiadro 32523 antracyt 40 24705 32523 3 78 wiader 5kg wiadro 32524 jaśmin 40 24705 32524 0 78 wiader 5kg wiadro 32526 bahama beż 40 24705 32526 4 78 wiader 5kg wiadro 32525 piaskowy 40 24705 32525 7 78 wiader 5kg wiadro 32527 jurajski beż 40 24705 32527 1 78 wiader 5kg wiadro 32528 szarobrązowy 40 24705 32528 8 78 wiader 5kg wiadro - bali brąz - 78 wiader",85
