product,description,page
ARDEX FK NEU,"Opis: Wysokowytrzymała zaprawa fugowa, szybka. Do fugowania: –płytek ceramicznych i gresowych, –płyt betonowych, –kamienia naturalnego (niewrażliwego na przebarwienia), –płytek klinkierowych i łupka, w warsztatach, myjniach samochodowych, powierzchniach przemysłowych, schodach, tarasach i balkonach w zakresie szerokości od 2 do 12 mm. Do stosowania: wewnątrz i zewnątrz, ściany i podłogi. Ciężar świeżej zaprawy: ok. 2,1 kg/l. Zużycie: przy szerokości spoiny 3 mm i głębokości 5 mm dla płytek lub średniej mozaiki: 60 x 60 cm ok. 0,10 kg /m2; 30 x 60 cm ok. 0,15 kg /m2; 30 x 30 cm ok. 0,20 kg /m2; 15 x 15 cm ok. 0,40 kg/m2; 10 x 10 cm ok. 0,60 kg /m2; 5 x 5 cm ok. 1,10 kg /m2. Czas użycia (20°C): ok. 30 minut. Możliwość chodzenia: po stwardnieniu po ok. 90 minutach. GISCODE: ZP1 zawiera cement, niskochromianowy. GEV EMICODE: EC1 R PLUS. Magazynowanie: w suchych pomieszczeniach 12 miesięcy w oryginalnie zamkniętym opakowaniu. Opakowanie Nr artykułu Kolor EAN-Nr Paleta 25 kg worek 4720 szary 9006445047199 40 worków 25 kg worek 4719 bazalt 9006445047205 40 worków",86
ARDEX RG12 1-6,"Opis: Drobnoziarnista fuga epoksydowa. Do fugowania płytek ceramicznych, łupka oraz mozaiki. Do klejenia mozaiki szklanej i porcelanowej na ścianach i podłogach. Do fugowania płyt ceramicznych, klinkieru i mozaiki, gdy zaprawy cementowe nie są wystarczająco odporne na obciążenia lub są zbyt mało trwałe, np. w: rzeźniach, mleczarniach, dużych kuchniach, browarach, akumulatorniach, basenach kąpielowych, prysznicach, łazienkach, pomieszczeniach sprzedaży, budowlach sportowych i wypoczynkowych oraz w innych zakresach, w których występują chemiczne lub wysokie obciążenia mechaniczne. Do szerokości fug od 1 do 6 mm. Do stosowania: wewnątrz i na zewnątrz, ściany i podłogi. Ciężar świeżej zaprawy: ok. 1,7 kg/l. Zużycie: przy szerokości spoiny 3 mm i głębokości 5 mm dla płytek lub średniej mozaiki: 15 x 15 cm ok. 0,30 kg/m2; 10 x 10 cm ok. 0,45 kg/m2; 5 x 5 cm ok. 0,90 kg/m2. Czas użycia (20°C): ok. 60 minut. Możliwość chodzenia: po stwardnieniu po ok. 12 godz. GISCODE: RE1 bezrozpuszczalnikowy. GEV EMICODE: EC1 R PLUS. Opakowania: 4 kg wiaderko - 3,2 kg żywicy + 0,8 kg utwardzacza; 1 kg wiaderko - 0,8 kg żywicy + 0,2 kg utwardzacza. Magazynowanie: w suchych pomieszczeniach 12 miesięcy w oryginalnie zamkniętym opakowaniu. Składować w pozycji pionowej, nie przewracać. Opakowanie Nr artykułu Kolor EAN-Nr Paleta 1kg wiadro 24038 antracyt - 384 wiadra 1kg wiadro 24039 bahama beż - 384 wiadra 1kg wiadro 24041 bali brąz - 384 wiadra 1kg wiadro 24040 bazalt - 384 wiadra 1kg wiadro 24037 szary - 384 wiadra 1kg wiadro 24090 szarobrązowy - 384 wiadra 1kg wiadro 24089 piaskowoszary - 384 wiadra 1kg wiadro 24036 srebrnoszary - 384 wiadra 1kg wiadro 24035 biały - 384 wiadra",87
ARDEX WA (fuga),"Opis: Fuga epoksydowa. Do fugowania płytek ceramicznych, płyt, płyt pilśniowych i mozaiki oraz do fugowania mozaiki ze szkła i porcelany na ścianach i podłogach. Odporna na chemikalia, wysoko odporny na obciążenia. Do fugowania płyt ceramicznych, klinkieru, płyt wiórowych i mozaiki, gdy zaprawy cementowe nie są wystarczająco odporne na obciążenia lub zbyt mało trwałe, np. w: rzeźniach, mleczarniach, dużych kuchniach, browarach, akumulatorniach, basenach i kąpieliskach, prysznicach, łazienkach, pomieszczeniach sprzedaży, budowlach sportowych i wypoczynkowych oraz w innych zakresach, w których występują chemiczne lub wysoko mechaniczne obciążenia. Do szerokości fug od 2 do 15 mm. Do stosowania: wewnątrz i zewnątrz, ściany i podłogi. Gęstość świeżej zaprawy: ok. 1,5 kg/l. Zużycie materiału: przy szerokości spoiny 3 mm i głębokości 5 mm dla płytek średniej mozaiki: 10×10 cm: ok. 0,45 kg/m2; 15×15 cm: ok. 0,30 kg/m2; 5×5 cm: ok. 0,90 kg/m2. Straty występują przy nakładaniu nadmiernej ilości materiału na płytki i wynoszą, w zależności od rodzaju płytki i sposobu nakładania, 0,10 do 0,20 kg/m2. Czas pracy (20°C): ok. 80 min. Czas układania płytek: ok. 80 min. Czas korygowania płytek: ok. 80 min. Możliwość obciążania ruchem pieszym (20°C): po wystarczającym wyschnięciu, po ok. 12 godz. GISCODE: RE 1 - bez rozpuszczalników. Opakowania: wiaderka po 3 kg pasty podstawowej „WA”, wieko po 1 kg utwardzacza „WA”. Magazynowanie: w suchych pomieszczeniach ok. 12 miesięcy w oryginalnie zamkniętym opakowaniu. Pojemniki składować w pozycji pionowej, nie przewracać. Opakowanie Nr artykułu Kolor EAN-Nr Paleta 4 kg wiadro 60413 biały 40 24705 60413 0 96 wiader 4 kg wiadro 60412 szary 40 24705 60412 3 96 wiader",88
ARDEX RG CLEANER,"Opis: Preparat do usuwania pozostałości fug epoksydowych. Specjalny środek czyszczący do usuwania resztek epoksydowych po fugowaniu. Finalne czyszczenie płytek ceramicznych po pracach okładzinowych. Wstępne czyszczenie mocno zabrudzonych okładzin przed dalszymi pracami. Czyszczenie narzędzi po pracach z materiałami epoksydowymi. Oznakowanie zgodnie z GHS/CLP: GHS 05 „drażniący”, hasło: „niebezpieczeństwo” Oznakowanie zgodnie z GGSB/ADR: Klasa 8, UN 1719, II, drażniący, alkaliczny, płynny środek, GISCODE: GG 80 Zużycie: ręczna aplikacja: ok. 100 – 200 ml na 10 l wody; maszynowa aplikacja: ok. 300 – 400 ml na 10 l wody. Rozpuszczalność w wodzie: całkowita. Gęstość: ok. 1.10 g /cm3. Opakowanie: butelka 1 l. Wartość pH: ok. 14. Temperatura stosowania: od 15°C do 25°C. Magazynowanie: przez okres 24 miesięcy.",89
ARDEX SE,"Opis: Silikon sanitarny. Silikon uszczelniający ze środkiem grzybobójczym. Elastyczne wypełnianie szczelin dylatacyjnych, narożnych i końcowych wewnątrz i na zewnątrz. Łatwy do obróbki, dobre właściwości sczepne, odporny na wpływy warunków atmosferycznych, na promienie UV oraz stosowanych w handlu środków czyszczących i odkażających. Elastyczne wypełnianie szczelin dylatacyjnych, narożnych i łączących: - w łazienkach, prysznicach i toaletach; - w pomieszczeniach mieszkalnych na powłokach ceramicznych, przy drzwiach, oknach i elementach zabudowy; - na powłokach ceramicznych na balkonach, tarasach i fasadach. Do stosowania: wewnątrz i zewnątrz, ściany i podłogi. Szerokość spoiny: do 30 mm. Temperatura pracy: +5°C do +40°C (temperatura podłoża). Główny czas wiązania: (ok. +23°C i 50% wilgotności powietrza) 10-12 min, po niewielu godzinach podatność na uszkodzenie filmu wierzchniego maleje. Prędkość utwardzania: (ok. +23°C i 50% wilgotność powietrza) ok. 2 mm/dzień; ok. 7 mm/tydzień. Wytrzymałość termiczna: -40°C do +180°C. Względne wydłużenie: ok. 25% szerokości fugi. Twardość według Shore’a: ok. 25 Zużycie materiału: 5×5 mm: ok. 12,0 m.b. z kartusza; 10×10 mm: ok. 3,0 m.b. z kartusza przy fugach narożnych zużycie jest dwukrotnie mniejsze niż podane wyżej. Magazynowanie: w chłodnym i suchym miejscu do ok. 24 miesięcy. Opakowanie Nr artykułu Kolor EAN-Nr Paleta kartusz 310 ml 73009 biały 40 24705 73009 9 - kartusz 310 ml 73041 pergamon 40 24705 73041 9 - kartusz 310 ml 73016 srebrnoszary 40 24705 73016 7 - kartusz 310 ml 73003 jasnoszary 40 24705 73003 7 - kartusz 310 ml 73042 manhattan 40 24705 73042 6 - kartusz 310 ml 73000 szary 40 24705 73000 6 - kartusz 310 ml 73040 cementowo-szary 40 24705 73040 2 - kartusz 310 ml 73017 bazaltowy 40 24705 73017 4 - kartusz 310 ml 73036 antracytowy 40 24705 73036 5 - kartusz 310 ml 73038 jaśminowy 40 24705 73038 9 - kartusz 310 ml 73022 beż bahama 40 24705 73022 8 - kartusz 310 ml 73043 średniobrązowy 40 24705 73043 3 - kartusz 310 ml 73023 czekoladowo-brązowy 40 24705 73023 5 - kartusz 310 ml 73034 brylantowo-biały 40 24705 73034 1 - kartusz 310 ml 73031 przezroczysty 40 24705 73031 0",90
ARDEX SC MATT,"Opis: Silikon matowy. Silikon uszczelniający ze środkiem grzybobójczym. Elastyczne wypełnianie szczelin dylatacyjnych, narożnych i końcowych. Łatwy do obróbki, dobre właściwości sczepne, odporny na wpływy warunków atmosferycznych, na promienie UV oraz stosowanych w handlu środków czyszczących i odkażających. Elastyczne wypełnianie szczelin dylatacyjnych, narożnych i łączących: – w łazienkach, prysznicach i toaletach; – w pomieszczeniach mieszkalnych na powłokach ceramicznych, przy drzwiach, oknach i elementach zabudowy; – na powłokach ceramicznych na balkonach, tarasach i fasadach. Do stosowania: wewnątrz i zewnątrz, ściany i podłogi. Szerokość spoiny: do 30 mm. Temperatura pracy: +5°C do +40°C (temperatura podłoża). Główny czas wiązania: (ok. +23°C i 50% wilgotności powietrza) 15-25 min. Prędkość utwardzania: (ok. +23°C i 50% wilgotności powietrza) ok. 2 mm/dzień, ok. 7 mm/tydzień. Wytrzymałość termiczna: -50°C do +180°C. Względne wydłużenie: ok. 20% szerokości fugi. Twardość według Shore’a: ok. 26 Zużycie materiału: 5×5 mm: ok. 12,0 m.b. z kartusza; 10×10 mm: ok. 3,0 m.b. z kartusza przy fugach narożnych zużycie jest dwukrotnie mniejsze niż podane wyżej. Magazynowanie: w chłodnym i suchym miejscu do ok. 12 miesięcy.",91
ARDEX ST,"Opis: Silikon do kamienia naturalnego. Silikon uszczelniający ze środkiem grzybobójczym. Fugowanie kamieni naturalnych, jak marmur, granit, kwarcyt itd. Elastyczne wypełnianie szczelin dylatacyjnych, narożnych i łączących wewnątrz i na zewnątrz. Łatwy do obróbki, dobre właściwości sczepne, odporny na wpływy warunków atmosferycznych, na promienie UV oraz stosowanych w handlu środków czyszczących i odkażających. Elastyczne wypełnianie szczelin dylatacyjnych, narożnych i łączących: - w łazienkach, prysznicach i toaletach; - w pomieszczeniach mieszkalnych na powłokach ceramicznych, na drzwiach, oknach i elementach zabudowanych; - na powłokach ceramicznych na balkonach, tarasach i fasadach. Do stosowania: wewnątrz i zewnątrz, ściany i podłogi. Szerokość spoin: do 30 mm na ścianach/do 15 mm na podłogach. Temperatura pracy: +5°C do +40°C (temperatura podłoża). Czas główny wiązania: (ok. +23°C i 50% wilgotności powietrza) ok. 15 min (po kilku godzinach powłoka jest już bardzo twarda). Prędkość utwardzania: (ok. +23°C i 50% wilgotność powietrza) ok. 1 mm/dzień, ok. 6 mm/tydzień. Wytrzymałość termiczna: -40°C do +120°C. Względne wydłużenie: ok. 20% szerokości fugi. Twardość według Shore’a: ok. 30. Zużycie materiału: 5×5 mm: ok. 12,0 m.b. z kartusza; 10×10 mm: ok. 3,0 m.b. z kartusza przy fugach narożnych zużycie jest dwukrotnie mniejsze niż podane wyżej. Magazynowanie: w chłodnym i suchym miejscu do ok. 12 miesięcy. Opakowanie Nr artykułu Kolor EAN-Nr Paleta 310 ml kartusz 73118 biały 40 24705 73118 8 - 310 ml kartusz 73114 srebrnoszary 40 24705 73114 0 - 310 ml kartusz 73117 kamienno-szary 40 24705 73117 1 - 310 ml kartusz 73116 antracytowy 40 24705 73116 4 - 310 ml kartusz 73119 piaskowobeżowy 40 24705 73119 5 - 310 ml kartusz 73115 beż jurajski 40 24705 73115 7 -",92
ARDEX CA 20 P,"Opis: Klej montażowy / Fuga elastyczna. 1-komponentowy klej montażowy na bazie krzemowodoru modyfikowany polimerami. Nie zawiera rozpuszczalników, wody oraz izocyjanianów. Dobre właściwości przylegające. Twardnieje, nie powodując kurczenia powierzchni dzięki elastycznym fugom odpornym na wibracje. Uszczelnia fugi w przypadku elementów wykonanych z metalu, drewna, ceramiki oraz tworzyw sztucznych. Klejenie i montowanie: -profili, listew cokołowych, listew zaciskowych, tuneli kablowych, -płyt izolacyjnych, -materiałów budowlanych wykonanych z drewna i tworzyw sztucznych, -profili metalowych, -elementów parkietowych, -płytek ceramicznych oraz innych materiałów do chłonnych i stabilnych podłoży. Do stosowania: wewnątrz i zewnątrz, ściany i podłogi. Baza surowcowa: zmodyfikowany polimer na bazie krzemowodoru. Konsystencja: tiksotropowa. Kolor: biały. Zużycie materiału: 30-40 ml/lfdm (w zależności od przycięcia dyszy). Czas tworzenia się powłoki (23°C/50% rF): ok. 7-10 min. Czas wiązania (23°C/50% rF): ok. 3-4 mm/24 godziny. Temperatura pracy: +5°C do 35°C. Odporność na działanie temperatur: -40°C do +90°C (krótkotrwale do +200°C, 15-20 min). Możliwość użytkowania: 24-48 godz. (w zależności od warunków). EMICODE: EC1 R - bardzo niski poziom emisji. Magazynowanie: chronić przed mrozem, w oryginalnie zamkniętych opakowaniach 18 miesięcy w suchych pomieszczeniach. Opakowanie Nr artykułu EAN-Nr Paleta kartusz 310 ml 73129 40 24705 73129 4 90 kartonów",93
ARDEX AF 2224,"Opis: Klej uniwersalny: – bardzo szerokie spektrum stosowania, – szczególnie przydatny do dekoracyjnych wykładzin PCV, – wysoka przyczepność początkowa, – wysoka wytrzymałość na ścinanie, – niski poziom emisji, – bezzapachowy po wyschnięciu, – bezrozpuszczalnikowy . Klej dyspersyjny do klejenia: – PVC we wszelkich postaciach: rolka, płyty, płytki itp. – CV – homogeniczne, – linoleum, – kauczukowych w rolach i płytach do grubości 4 mm, – tekstylnych, – tekstylnych z gąbką lateksową lub lateksowana warstwą przylegania, – tekstylnych z naturalną włókniną, – tekstylnych tkanych jedno i wielowarstwowych wykładzin igłowych, – płyty kwarcowo winylowe, – kokosowych i sizalowych w połączeniu i bez osnowy warstwy przylegania. Do stosowania: wewnątrz, na podłogach. Czas wstępnego odparowania: do 15 minut. Czas układania: do 20 minut. Odpowiedni przy ogrzewaniu podłogowym: tak. EMICODE: EC1 - bardzo niskoemisyjny. GISCODE: D1 - nie zawiera rozpuszczalników. Magazynowanie: Przechowywać w chłodnym miejscu, ale zabezpieczonym przed mrozem w oryginalnie zamkniętym opakowaniu przez okres ok. 12 miesięcy. Opakowanie Nr artykułu EAN-Nr Paleta 12 kg wiadro 70168 40 24705 70168 6 44 wiadra",94
ARDEX AF 823,"Opis: Grunt dyspersyjny przewodzący. Przewodzący podkład dyspersyjny. Do stosowania z uniwersalnym klejem przewodzącym „AF 2270”. Zastępuje układanie taśmy miedzianej. Niskoemisyjny. Przewodzący podkład dyspersyjny, stosowany z klejem „AF 2270” do klejenia: – wykładzin PCV, – wykładzin tekstylnych, – linoleum, – wykładzin gumowych na chłonnych i niechłonnych powierzchniach wewnątrz. Do stosowania: wewnątrz, podłogi. Baza surowcowa: mieszanina dyspersji tworzyw sztucznych. Zużycie materiału: ok. 120- 150 g/m² (aplikacja wałkiem). Warunki pracy: temperatura otoczenia: min.+15°C; względna wilgotność powietrza: max. 75%. Czas schnięcia: 3 do 5 godzin. Właściwości przewodzące podkładu: < 3 x 105 Ω. Niższe temperatury oraz wyższe wartości wilgotności względnej powietrza mogą wydłużyć czas wiązania. Podany czas odnosi się do temperatury +20°C i względnej wilgotności powietrza 50%. Środki czyszczące: przed wyschnięciem: woda. Odporność na obciążenia skupione: tak. EMICODE: EC1PLUS - niski poziom emisji. GISCODE: D1 Oznakowanie GHS/CLP: brak. Oznakowanie GGVSEB/ADR: brak. Magazynowanie: w suchych pomieszczeniach, przez 12 miesięcy w oryginalnie zamkniętym opakowaniu. Opakowanie Nr artykułu EAN-Nr Paleta 10 kg kanister 37212 40 24705 37212 1 60 kanistrów",95
ARDEX AF 2270,"Opis: Klej uniwersalny, przewodzący: – przeznaczony do wykładzin tekstylnych i elastycznych, – w przypadku wykładzin tekstylnych, kauczukowych oraz linoleum można zrezygnować z gruntowania powierzchni, – trwale przylega do powierzchni, – niskoemisyjny, bezrozpuszczalnikowy. Jasny klej dyspersyjny do klejenia przewodzących: – wykładzin tekstylnych, – wykładzin z dodatkiem włókna igłowego, – linoleum, – wykładzin z PCV, – wykładzin kauczukowych o grubości do 3,5 mm na chłonnych podłożach. Do stosowania: wewnątrz. Baza surowcowa: dyspersja akrylowa. Warunki pracy: temperatura: nie poniżej +15°C; względna wilgotność powietrza; maks. 75%. Czas wstępnego odparowania: ok. 5-15 min. Czas pracy: 5-40 min. Niższe temperatury oraz wyższe wartości względnej wilgotności powietrza mogą wydłużać czas wiązania. Podany czas odnosi się do temperatury +18°C i względnej wilgotności powietrza 65%. Środki czyszczące: przed wyschnięciem: woda. Odporność na obciążenie skupione: tak. Przydatność w systemie ogrzewania podłogowego: tak. Właściwości przewodzące kleju (dIN EN 13415): 104 do 3×105 Ω opór. EMICOdE: EC1 – bardzo niski poziom emisji substancji organicznych. gISCOdE: D1 – bez rozpuszczalnika. Oznaczenie wg gefStoffV, adR, ggVS,VbF: brak. Magazynowanie: w suchych pomieszczeniach ok. 12 miesięcy w oryginalnie zamkniętym opakowaniu. Chronić przed mrozem. Opakowanie Nr artykułu EAN-Nr Paleta 18 kg wiadro 70226 40 24705 70226 3 24 wiadra",96
ARDEX AF 130,"Opis: Klej obiektowy do wykładzin elastycznych: – do mocowania okładzin PVC, CV, – dobra przyczepność początkowa, – niskoemisyjny. Klej dyspersyjny do mocowania: – okładzin PVC, – okładzin CV, – okładzin LVT na chłonnych podłożach, – dobra przyczepność początkowa, – niskoemisyjny. Do stosowania: wewnątrz, podłogi. Baza surowcowa: mieszanina dyspersji tworzyw sztucznych. Zużycie materiału: ok. 280 – 320 g/m2 w zależności od użytej pacy. Warunki pracy: temperatura otoczenia: nie poniżej +15°C; względna wilgotność powietrza: max. 75%. Czas wstępnego odparowania: od 5 do 20 min. Czas pracy: od 10 do 20 min. Niższe temperatury oraz wyższe wartości wilgotności względnej powietrza mogą wydłużyć czas wiązania. Podany czas odnosi się do temperatury +18°C i względnej wilgotności powietrza 65%. Środki czyszczące: przed wyschnięciem: woda. Odporność na obciążenia skupione: tak. EMICODE: EC1PLUS - niski poziom emisji. GISCODE: D1 – bez rozpuszczalnika. Oznakowanie GHS/CLP: brak. Oznakowanie GGVSEB/ADR: brak. Magazynowanie: w suchych, ogrzewanych pomieszczeniach, przez 12 miesięcy w oryginalnie zamkniętym opakowaniu. Opakowanie Nr artykułu EAN-Nr Paleta 13 kg wiadro 30379 40 24705 30379 8 44 wiadra",97
ARDEX AF 140,"Opis: Klej wzmacniany włóknami do wykładzin PCV. Szczególnie nadaje się do wykładzin PVC, LVT oraz wykładzin dekoracyjnych. Wzmocnienie włóknem minimalizuje ryzyko odkształceń. Doskonałe zwilżanie powierzchni. Bardzo niska emisja. Do stosowania: wewnątrz, podłogi. Materiał bazowy: dyspersja tworzyw sztucznych. Temperatura: powyżej +15°C. Wilgotność powietrza (rF): poniżej 75%. Czas wstępnego odparowania: od 0 do 10 minut. Czas układania: ok. 10 minut. Niższe temperatury i wyższe wartości względnej wilgotności powietrza mogą wydłużać czas wiązania. Podany czas odnosi się do temperatury +18°C i względnej wilgotności powietrza 65% (rF). Środki czyszczące: Przed wyschnięciem: woda. Odporność na obciążenia: tak (kółka–zgodnie z normą EN 12529). Ogrzewanie podłogowe: tak. Odpowiedni przy użyciu szamponów i sprayów: tak. EMICODE: EC1PLUS – bardzo niska emisja. GISCODE: D1 – nie zawiera rozpuszczalników TRGS 610, RAL– UZ 113. Oznaczenie wg GHS/CLP: nie. Oznaczenie według GGVSEB/ADR: nie. Magazynowanie: Przechowywać w chłodnym miejscu, ale zabezpieczonym przed mrozem w zamkniętym opakowaniu. Ok. 12 miesięcy w oryginalnie zamkniętym opakowaniu. Opakowanie Nr artykułu EAN-Nr Paleta 12 kg Wiadro 30384 4024705303842 44 wiadra",98
ARDEX AF 155,"Opis: Specjalny klej do wykładzin elastycznych. Szerokie spektrum zastosowania. Długi czas otwarty. Bardzo niskoemisyjny. „AF 155” charakteryzuje się uniwersalnym zastosowaniem podczas klejenia metodą mokrą i półmokrą. Klej dyspersyjny do mocowania: – okładzin PVC, – okładzin CV, – okładzin LVT, – wykładzin kwarcowo winylowych, – wykładzin gumowych do 2,5 mm grubości, – wykładzin tekstylnych, lateksowych, PVC na chłonnych i niechłonnych podłożach. Do stosowania: wewnątrz, ściany i podłogi. Baza surowcowa: mieszanina dyspersji tworzyw sztucznych. Zużycie materiału: ok. 250 – 450 g/m2 w zależności od użytej pacy. Warunki pracy: temperatura otoczenia: nie poniżej +15°C; względna wilgotność powietrza: max. 75%. Czas wstępnego odparowania: od 5 do 20 min. na chłonnych podłożach przy metodzie mokrej, 30 do 60 min. na niechłonnych podłożach przy metodzie pół mokrej i kontaktowej. Czas pracy: od 5 do 60 min. Niższe temperatury oraz wyższe wartości wilgotności względnej powietrza mogą wydłużyć czas wiązania. Podany czas odnosi się do temperatury +18°C i względnej wilgotności powietrza 65%. Środki czyszczące: przed wyschnięciem: woda. Odporność na obciążenia skupione: tak. Przydatność w systemie ogrzewania podłogowego: tak. EMICODE: EC1PLUS - niski poziom emisji. GISCODE: D1 – bez rozpuszczalnika. Oznakowanie GHS/CLP: brak. Oznakowanie GGVSEB/ADR: brak. Magazynowanie: w suchych, ogrzewanych pomieszczeniach, przez 12 miesięcy w oryginalnie zamkniętym opakowaniu. Opakowanie Nr artykułu EAN-Nr Paleta 11 kg wiadro 30371 40 24705 30371 2 44 44 wiadra",99
ARDEX AF 180,"Opis: Klej SMP do wykładzin elastycznych: – na powierzchnie wysokoobciążone, – szybki przyrost wytrzymałości, – łatwa aplikacja, brak konieczności mieszania, – homogeniczne i heterogeniczne okładziny PVC w rolkach i płytkach, – dekoracyjne płytki PVC, – podłóg CV, – wykładzin kauczukowych, – wykładzin korkowych PVC, – linoleum, – sztucznej trawy, – wykładzin igłowanych na odpowiednich, chłonnych i niechłonnych podłożach wewnątrz i na zewnątrz pomieszczeń. Do stosowania: wewnątrz i zewnątrz, podłogi. Baza surowcowa: silany modyfikowane polimerami. Zużycie materiału: ok. 300-580 g/m2 w zależności od użytej pacy. Warunki pracy: temperatura otoczenia: nie poniżej +15°C; względna wilgotność powietrza: max. 75%. Czas wstępnego odparowania: ok. 20 min. Czas pracy: ok. 35 min. Niższe temperatury oraz wyższe wartości wilgotności względnej powietrza mogą wydłużyć czas wiązania. Podany czas odnosi się do temperatury +18°C i względnej wilgotności powietrza 65%. Środki czyszczące: przed wyschnięciem odpowiednimi środkami czyszczącymi. Odporność na obciążenia skupione: tak. Przydatność w systemie ogrzewania podłogowego: tak. EMICODE: EC1PLUSR - bardzo niski poziom emisji. GISCODE: RS10. Oznakowanie GHS/CLP: brak. Oznakowanie GGVSEB/ADR: brak. Magazynowanie: w suchych, ogrzewanych pomieszczeniach, przez 12 miesięcy w oryginalnie zamkniętym opakowaniu. Opakowanie Nr artykułu EAN-Nr Paleta 7,5 kg wiadro 32499 40 24705 32499 1 72 wiadra",100
ARDEX AF 181 W,"Opis: Na powierzchnie wysokoobciążone. Szybki przyrost wytrzymałości. Łatwa aplikacja, brak konieczności mieszania. Możliwość aplikacji wałkiem Homogeniczne i heterogeniczne okładziny PVC w rolkach i płytkach: -dekoracyjne płytki PVC, -podłóg CV, -wykładzin kauczukowych, -wykładzin korkowych PVC, -linoleum, -sztucznej trawy, -wykładzin igłowanych na odpowiednich, - chłonnych i niechłonnych podłożach wewnątrz i na zewnątrz pomieszczeń. Do stosowania: wewnątrz i zewnątrz, ściany i podłogi. Baza surowcowa: silany modyfikowane polimerami. Zużycie materiału: ok. 300-580 g/m² w zależności od użytej pacy lub wałka. Warunki pracy: temperatura otoczenia: nie mniej niż +15°C; względna wilgotność powietrza: min. 50%. Czas wstępnego odparowania: od 10- 40 min. Czas pracy: ok. 10- 45 min. Niższe temperatury oraz wyższe wartości wilgotności względnej powietrza mogą wydłużyć czas wiązania. Podany czas odnosi się do temperatury +18°C i względnej wilgotności powietrza 65%. Środki czyszczące: przed utwardzeniem: odpowiednie środki czyszczące zawierające olej lub wosk, np. szmatki do czyszczenia CW. Odporność na obciążenia skupione: tak (kółka–zgodnie z normą EN 12529). Przydatność w systemie ogrzewania podłogowego: tak EMICODE: EC1PLUS - niski poziom emisji. GISCODE: RS10 - Materiały zawierające metoksysilan. Oznakowanie GHS/CLP: brak. Oznakowanie GGVSEB/ADR: brak. Magazynowanie: w suchych pomieszczeniach, przez 12 miesięcy w oryginalnie zamkniętym opakowaniu. Opakowanie Nr artykułu EAN-Nr Paleta 7,5 KG WIADRO 39006 4024705390064 72 WIADRA",101
